id,text,textgr168,"Christianity gave Eros poison to drink - he did not die of it, to be sure, but degenerated into vice.","Das Christenthum gab dem Eros Gift zu trinken: - er starb zwar nicht daran, aber entartete, zum Laster."169,to talk about oneself a great deal can also be a means of concealing oneself.,"Viel von sich reden kann auch ein Mittel sein, sich zu verbergen."170,In praise there is more importunity than in blame.,"Im Lobe ist mehr Zudringlichkeit, als im Tadel."171,"Pity in a man of knowledge seems almost ludicrous, like sensitive hands on a Cyclops.","Mitleiden wirkt an einem Menschen der Erkenntniss beinahe zum Lachen, wie zarte Hände an einem Cyklopen."172,From love of man one sometimes embraces anyone (because one cannot embrace everyone): but one must never let this anyone know it. . .,Man umarmt aus Menschenliebe bisweilen einen Beliebigen (weil man nicht Alle umarmen kann): aber gerade Das darf man dem Beliebigen nicht verrathen.....173,"One does not hate so long as one continues to rate low, but only when one has come to rate equal or higher.","Man hasst nicht, so lange man noch gering schätzt, sondern erst, wenn man gleich oder höher schätzt."174,"You utilitarians, you too love everything useful only as a vehicle of your inclinations - you too really find the noise of its wheels intolerable?","Ihr Utilitarier, auch ihr liebt alles utile nur als ein Fuhrwerk eurer Neigungen, - auch ihr findet eigentlich den Lärm seiner Räder unausstehlich?"175,Ultimately one loves one's desires and not that which is desired.,"Man liebt zuletzt seine Begierde, und nicht das Begehrte."176,The vanity of others offends our taste only when it offends our vanity.,"Die Eitelkeit Andrer geht uns nur dann wider den Geschmack, wenn sie wider unsre Eitelkeit geht."177,Perhaps no one has ever been sufficiently truthful about what `truthfulness' is.,"Ober Das, was ""Wahrhaftigkeit"" ist, war vielleicht noch Niemand wahrhaftig genug."178,Clever people are not credited with their follies: what a deprivation of human rights!,Klugen Menschen glaubt man ihre Thorheiten nicht: welche Einbusse an Menschenrechten!179,"The consequences of our actions take us by the scruff of the neck, altogether indifferent to the fact that we have `improved' in the meantime.","Die Folgen unsrer Handlungen fassen uns am Schopfe, sehr gleichgültig dagegen, dass wir uns inzwischen ""gebessert"" haben."180,There is an innocence in lying which is the sign of good faith in a cause.,"Es giebt eine Unschuld in der Lüge, welche das Zeichen des guten Glaubens an eine Sache ist."181,It is inhuman to bless where one is cursed.,"Es ist unmenschlich, da zu segnen, wo Einem geflucht wird."182,"The familiarity of the superior embitters, because it may not be returned.","Die Vertraulichkeit des überlegenen erbittert, weil sie nicht zurückgegeben werden darf. -"183,`Not that you lied to me but that I no longer believe you - that is what has distressed me -.',"Nicht dass du mich belogst, sondern dass ich dir nicht mehr glaube,hat mich erschüttert. -"184,There is a wild spirit of good-naturedness which looks like malice.,"Es giebt einen Übermuth der Güte, welcher sich wie Bosheit ausnimmt."185,`I do not like it.' - Why? - `I am not up to it.' - Has anyone ever answered like that?,"Er missfällt mir. - Warum? - ""Ich bin ihm nicht gewachsen."" - Hat je ein Mensch so geantwortet?"